,ClassIndex,Title,Description
278,4,Knocking on Heaven's Door,"The Milky Way is a vast, diverse neighborhood. If you're hoping to find Earthlike planets that may harbor life, you'll need to narrow the search. Stars are a good place to start, because the dusty discs around stars spawn young planets."
279,4,China Begins Countdown for Next Manned Space Flight,"By ELAINE KURTENBACH    SHANGHAI, China (AP) -- Chinese astronauts are in the final stages of preparing for a manned space mission that will orbit the globe 14 times before returning to Earth, a state-run newspaper reported Thursday.    The launch, expected sometime this month, will initially send a manned craft, the Shenzhou 5, into an oval orbit that at its closest will be 125 miles from Earth, the Liberation Daily reported, citing ""relevant channels.""    After circling the earth several times, the ship will enter an orbit at about 220 miles from earth, the report said..."
280,4,Trajectory Maneuver Brings Genesis Spacecraft Closer to Home,"Jet Propulsion Lab -- Thirty days before its historic return to Earth with NASA's first samples from space since the Apollo missions, the Genesis spacecraft successfully completed its twentieth trajectory maneuver.     At 12:00 Universal Time (5:00 a.m..."
281,4,Japanese Lunar Probe Mission Facing Delays,"TOKYO (AP) -- A lunar orbiter that Japan had planned to launch this year could face further delays, possibly until next year or later, because of a funding shortfall and problems developing the probe's information-gathering capabilities, Japan's space agency said Wednesday.    The Japan Aerospace Exploration Agency, or JAXA, released a report to a government-run commission explaining expected delays to the launch of the \$135 million Lunar-A probe..."
282,4,Progress Cargo Ship for ISS Launched From Russia,"MOSCOW (AP) -- A Russian cargo ship loaded with supplies and equipment blasted off from the Baikonour cosmodrome in Kazakhstan on Wednesday headed for the international space station, a Russian space official said.    The Progress M-50 ship took off at 1:03 a.m..."
283,4,The Annual Perseid Meteor Shower,"The annual Perseid meteor shower is coming, and forecasters say it could be unusually good. Like bugs streaking down the side window of a moving car, colorful Perseid Earthgrazers could put on a pleasing show after sunset this week."
284,4,NASA Approves Robotic Hubble Repair Mission,"(AP) -- NASA's chief is urging his Hubble Space Telescope team to press ahead with plans for a robotic repair mission to the aging observatory, saying, ""Let's go save the Hubble.""    Administrator Sean O'Keefe says he will ask Congress for money to accomplish the job. He estimates it will take about \$1 billion to \$1.6 billion to develop and launch a robot to make the needed upgrades to keep the popular telescope running and to get it out of orbit once its work is through..."
285,4,What Is a Comet Made Of?,"UC Davis -- A new method for looking at the composition of comets using ground-based telescopes has been developed by chemists at UC Davis. Remnants from the formation of our solar system, the makeup of comets gives clues about how the Earth and other planets formed..."
286,4,Dying Star Goes Out With a Ring,"A new image from NASA's Spitzer Space Telescope shows the shimmering embers of a dying star, and in their midst a mysterious doughnut-shaped ring. The dying star is part of a ""planetary nebula"" called NGC 246. When a star like our own Sun begins to run out of fuel, its core shrinks and heats up, boiling off the star's outer layers."
287,4,Lost Sleep Leads to Health Problems,"Advice on how to get a good night's slumber and avoid future heart trouble    HealthDayNews -- Lack of sleep can cause more than drowsiness; it can contribute to a number of health problems.    Short-term effects of lack of sleep include increases in blood pressure and levels of stress hormones, according to an article in the August issue of the Harvard Heart Letter..."
288,4,Which Diet is Best? The One That Works for You,"By Kathleen Doheny, HealthDay Reporter    HealthDayNews -- Gather together some diners who are trying to lose weight, then sit back and listen to the debate.    Almost anyone who's on a diet -- or at least one that's working -- is convinced his or her plan is the best..."
289,4,Clouds are Cooler than Smoke,"Clouds help regulate the Earths climate by reflecting sunlight into space, thus cooling the surface. When cloud patterns change, they modify the Earths energy balance in turn, and temperatures on the Earths surface."
290,4,Last Year's Flu Shot Imperfect But Effective,"By Amanda Gardner, HealthDay Reporter    HealthDayNews -- Last year's influenza vaccine was far from a perfect match against the virus that sickened people, but it offered more protection from the illness than experts had previously thought.    In very young children, the shot was found to be 25 percent to 49 percent effective in preventing influenza-like illness, which is a suspected case of flu that wasn't confirmed in a laboratory..."
291,4,Olympics Could Call Out the Couch Potatoes,"As the 2004 Summer Olympics officially get underway Friday with an international broadcast of the opening ceremonies, health experts expect the Athens games to inspire couch potatoes to become more active. But, experts caution, amateurs, particularly sedentary ones, should not jump into a new sports activity without sufficient preparation."
292,4,Skateboarding Offers a Tough Workout,"By KRISTA LARSON     SAYREVILLE, N.J. (AP) -- While the tennis courts at Kennedy Park are bare on a hot afternoon, parents keep dropping off teenagers at the skate park, home to all the day's action..."
293,4,Rats May Help Unravel Human Drug Addiction Mysteries,"By LAURAN NEERGAARD    WASHINGTON (AP) -- Rats can become drug addicts. That's important to know, scientists say, and has taken a long time to prove..."
294,4,Sting of Bug Bites Can Linger Into Adulthood,"By Amanda Gardner, HealthDay Reporter    HealthDayNews -- Contrary to popular belief, not all kids who are allergic to insect stings outgrow their sensitivity.    Some people whose allergies left them in fear of bees, wasps, and the like as children still react to their stings as adults, but a new study offers relief: Allergy shots given in childhood can protect them for up to 20 years..."
295,4,FDA Warns of Terrorist Prescription Drug Tampering,"By DIEDTRA HENDERSON     WASHINGTON (AP) -- ""Cues from chatter"" gathered around the world are raising concerns that terrorists might try to attack the domestic food and drug supply, particularly illegally imported prescription drugs, acting Food and Drug Administration Commissioner Lester M. Crawford says..."
296,4,Scientists Probe Pacific Ocean for Dead Zones,"His hand on a toggle switch and his eyes on a computer screen, Oregon State University graduate student Anthony Kirincich uses an array of scientific instruments to probe the vibrant waters of the Pacific. He is searching for the absence of life."
297,4,Simultaneous Tropical Storms are Very Rare,"The prospect that a tropical storm and a hurricane - or possibly two hurricanes - could strike Florida on the same day is something meteorologists say they have never seen. ""It's almost unheard of,"" state meteorologist Ben Nelson said."
298,4,Deaths Raise Fears Over Stomach Stapling Surgery,"By LINDA A. JOHNSON    (AP) -- An obese Massachusetts woman and her 8-month-old fetus died of complications 18 months after stomach-stapling surgery, an apparent first that is leading to warnings about the risks of pregancy soon after the surgery..."
299,4,Growth and Mortality Details of T. Rex Get Clearer,"T. rex was one of the largest meat-eaters ever to walk the land when it died out some 65 million years ago. At an elephant-like 6 tons, it stretched about 40 feet to 45 feet long and measured about 13 feet tall at the hip. The adult skull alone was 5 feet long, with teeth up to a foot long."
