,ClassIndex,Title,Description
0,3,Wall St. Bears Claw Back Into the Black (Reuters),"Reuters - Short-sellers, Wall Street's dwindling\band of ultra-cynics, are seeing green again."
1,3,Carlyle Looks Toward Commercial Aerospace (Reuters),"Reuters - Private investment firm Carlyle Group,\which has a reputation for making well-timed and occasionally\controversial plays in the defense industry, has quietly placed\its bets on another part of the market."
2,3,Oil and Economy Cloud Stocks' Outlook (Reuters),Reuters - Soaring crude prices plus worries\about the economy and the outlook for earnings are expected to\hang over the stock market next week during the depth of the\summer doldrums.
3,3,Iraq Halts Oil Exports from Main Southern Pipeline (Reuters),"Reuters - Authorities have halted oil export\flows from the main pipeline in southern Iraq after\intelligence showed a rebel militia could strike\infrastructure, an oil official said on Saturday."
4,3,"Oil prices soar to all-time record, posing new menace to US economy (AFP)","AFP - Tearaway world oil prices, toppling records and straining wallets, present a new economic menace barely three months before the US presidential elections."
5,3,"Stocks End Up, But Near Year Lows (Reuters)","Reuters - Stocks ended slightly higher on Friday\but stayed near lows for the year as oil prices surged past  #36;46\a barrel, offsetting a positive outlook from computer maker\Dell Inc. (DELL.O)"
6,3,Money Funds Fell in Latest Week (AP),"AP - Assets of the nation's retail money market mutual funds fell by  #36;1.17 billion in the latest week to  #36;849.98 trillion, the Investment Company Institute said Thursday."
7,3,Fed minutes show dissent over inflation (USATODAY.com),"USATODAY.com - Retail sales bounced back a bit in July, and new claims for jobless benefits fell last week, the government said Thursday, indicating the economy is improving from a midsummer slump."
8,3,Safety Net (Forbes.com),"Forbes.com - After earning a PH.D. in Sociology, Danny Bazil Riley started to work as the general manager at a commercial real estate firm at an annual base salary of  #36;70,000. Soon after, a financial planner stopped by his desk to drop off brochures about insurance benefits available through his employer. But, at 32, ""buying insurance was the furthest thing from my mind,"" says Riley."
9,3,Wall St. Bears Claw Back Into the Black," NEW YORK (Reuters) - Short-sellers, Wall Street's dwindling  band of ultra-cynics, are seeing green again."
10,3,Oil and Economy Cloud Stocks' Outlook, NEW YORK (Reuters) - Soaring crude prices plus worries  about the economy and the outlook for earnings are expected to  hang over the stock market next week during the depth of the  summer doldrums.
11,3,No Need for OPEC to Pump More-Iran Gov," TEHRAN (Reuters) - OPEC can do nothing to douse scorching  oil prices when markets are already oversupplied by 2.8 million  barrels per day (bpd) of crude, Iran's OPEC governor said  Saturday, warning that prices could fall sharply."
12,3,Non-OPEC Nations Should Up Output-Purnomo," JAKARTA (Reuters) - Non-OPEC oil exporters should consider  increasing output to cool record crude prices, OPEC President  Purnomo Yusgiantoro said on Sunday."
13,3,Google IPO Auction Off to Rocky Start, WASHINGTON/NEW YORK (Reuters) - The auction for Google  Inc.'s highly anticipated initial public offering got off to a  rocky start on Friday after the Web search company sidestepped  a bullet from U.S. securities regulators.
14,3,Dollar Falls Broadly on Record Trade Gap, NEW YORK (Reuters) - The dollar tumbled broadly on Friday  after data showing a record U.S. trade deficit in June cast  fresh doubts on the economy's recovery and its ability to draw  foreign capital to fund the growing gap.
15,3,Rescuing an Old Saver,"If you think you may need to help your elderly relatives with their finances, don't be shy about having the money talk -- soon."
16,3,Kids Rule for Back-to-School,The purchasing power of kids is a big part of why the back-to-school season has become such a huge marketing phenomenon.
17,3,"In a Down Market, Head Toward Value Funds","There is little cause for celebration in the stock market these days, but investors in value-focused mutual funds have reason to feel a bit smug -- if only because they've lost less than the folks who stuck with growth."
18,3,US trade deficit swells in June,"The US trade deficit has exploded 19 to a record \$55.8bn as oil costs drove imports higher, according to a latest figures."
19,3,Shell 'could be target for Total',"Oil giant Shell could be bracing itself for a takeover attempt, possibly from French rival Total, a  press report claims."
20,3,Google IPO faces Playboy slip-up,"The bidding gets underway for Google's public offering, despite last-minute worries over an interview with its bosses in Playboy magazine."
21,3,Eurozone economy keeps growing,"Official figures show the 12-nation eurozone economy continues to grow, but there are warnings it may slow down later in the year."
22,3,Expansion slows in Japan,Economic growth in Japan slows down as the country experiences a drop in domestic and corporate spending.
23,3,Rand falls on shock SA rate cut,"Interest rates are trimmed to 7.5 by the South African central bank,  but the lack of warning hits the rand and surprises markets."
24,3,Car prices down across the board,"The cost of buying both new and second hand cars fell sharply over the past five years, a new survey has found."
25,3,South Korea lowers interest rates,South Korea's central bank cuts interest rates by a quarter percentage point to 3.5 in a bid to drive growth in the economy.
26,3,Google auction begins on Friday,"An auction of shares in Google, the web search engine which could be floated for as much as \$36bn, takes place on Friday."
27,3,HP shares tumble on profit news,"Hewlett-Packard shares fall after disappointing third-quarter profits, while the firm warns the final quarter will also fall short of expectations."
28,3,Mauritian textile firm cuts jobs,One of the oldest textile operators on the Indian Ocean island of Mauritius last week shut seven factories and cut 900 jobs.
29,3,Chad seeks refugee aid from IMF,"Chad asks the IMF for a loan to pay for looking after more than 100,000 refugees from conflict-torn Darfur in western Sudan."
30,3,Japan nuclear firm shuts plants,The company running the Japanese nuclear plant hit by a fatal accident is to close its reactors for safety checks.
31,3,Veteran inventor in market float,"Trevor Baylis, the veteran inventor famous for creating the Freeplay clockwork radio, is planning to float his company on the stock market."
32,3,Saudi Arabia to open up oil taps,"Saudi Arabia says it is ready to push an extra 1.3 million barrels a day of oil into the market, to help reverse surging prices."
33,3,Saudi phone sector gets \$1bn lift,A group led by the UAE's Etisalat plans to spend \$1bn (544m) on expansion after winning two mobile phone licences in Saudi Arabia.
34,3,Indians fill rail skills shortage,Network Rail flies in specialist Indian engineers to work on the West Coast Mainline because of a UK skills shortage.
35,3,Steady as they go,BEDFORD -- Scientists at NitroMed Inc. hope their experimental drugs will cure heart disease someday. But lately their focus has been on more mundane matters.
36,3,"Google IPO: Type in 'confusing,' 'secrecy'",I've submitted my bid to buy shares of Google Inc. in the computer search company's giant auction-style initial public offering. That could turn out to be the good news or the bad news.
37,3,A bargain hunter's paradise,"Massachusetts bargain hunters showed up in droves and shopped hard on yesterday's sales tax holiday, buying everything from treadmills and snow blowers to candles and chandeliers, and crediting the 5-percent tax break with bringing them into the stores."
38,3,Researchers seek to untangle the e-mail thread,"E-mail is a victim of its own success. That's the conclusion of IBM Corp. researchers in Cambridge, who have spent nearly a decade conducting field tests at IBM and other companies about how employees work and use electronic mail. It's clear to them that e-mail has become the Internet's killer application."
39,3,Microsoft Corp. 2.0: a kinder corporate culture,"Even a genius can mess up. Bill Gates was a brilliant technologist when he cofounded Microsoft , but as he guided it to greatness in both size and historical consequence, he blundered. He terrorized underlings with his temper and parceled out praise like Scrooge gave to charity. Only the lash inspired the necessary aggressiveness to beat the competition, he thought."
40,3,Letters,"Target the abusers of legal weapons We can all share the outrage, expressed by columnist Steve Bailey (''Summer Sizzler, quot; Aug. 11), at the killings in the city's poor neighborhoods. But there's no need to share his ignorance. He argues for renewal of the so-called assault weapon ban, claiming that otherwise, ''UZIs and AK-47s could again be flooding the streets. quot; His ..."
41,3,Somewhere between gleam and gloom,"President Bush has been saying that the US economy has ''turned the corner. quot; Democratic presidential candidate Senator John F. Kerry, in the wake of this month's poor jobs report, quipped that it was more like a U-turn."
42,3,Technology company sues five ex-employees ,"A Marlborough-based technology company is suing five former employees, including three senior managers, for allegedly conspiring against their employer while working on opening a competing business."
43,3,Grant to aid Lynn Central Square,"Central Square in Lynn should be looking a bit brighter. New sidewalks, curbs, fences, lights, landscaping, and road improvements are planned for the Gateway Artisan Block, a key area of the square, with \$830,000 in state grant money given to Lynn last week."
44,3,State grant to aid Lynn; Bank gives Salem \$10k,"Central Square in Lynn should be looking a bit brighter. New sidewalks, curbs, fences, lights, landscaping, and road improvements are planned for the Gateway Artisan Block, a key area of the square, with \$830,000 in state grant money given to Lynn last week."
45,3,A New Legal Chapter for a 90's Flameout,"A lawsuit against Gary Winnick, the former chief of Global Crossing, refocuses attention on what Mr. Winnick knew about his company's finances as it imploded."
46,3,"Will Russia, the Oil Superpower, Flex Its Muscles?",Russia is again emerging as a superpower - but the reason has less to do with nuclear weapons than with oil.
47,3,"Switching Titles, if Not Gears, at Dell","Kevin B. Rollins, the new chief executive of Dell, talks about Dell's transitory slip in customer service, and why he sees a broader technology recovery taking place."
48,3,For Sale: The Ultimate Status Symbol,"With the country in need of cash and rich people dying to show off their wealth, Mr. Stein proposes a unique solution: having the government sell titles of nobility."
49,3,Quality Gets Swept Away,Quality Distribution is hammered after reporting a large loss for the second quarter.
50,3,Making Your Insurer Pay,"If Hurricane Charley blows your house down, how can you make your insurance company pay?"
51,3,Delightful Dell,The company's results show that it's not grim all over tech world. Just all of it that isn't Dell.
52,3,Chrysler's Bling King,"After a tough year, Detroit's troubled carmaker is back -- thanks to a maverick designer and a car that is dazzling the hip-hop crowd"
53,3,What's Cool In the Pool ... ... And Hot On the Deck,Americans are spending more on tricking out the places where they swim. Here's a look at the new wave of accessories
54,3,The Age of Doom,In 1993 six geeks had a digital nightmare that changed the culture. It's about to get far creepier
55,3,Hip Hop's Online Shop,Celebrity fashion is booming. These webpreneurs are bringing it to main street
56,3,Stoking the Steamroller,No other recording artist can channel American middle-class tastes quite like Chip Davis and his best-selling band
57,3,Coming to The Rescue,Got a unique problem? Not to worry: you can find a financial planner for every specialized need
58,3,The New Customers Are In Town,"Today's customers are increasingly demanding, in Asia as elsewhere in the world.  Henry Astorga describes the complex reality faced by today's marketers, which includes much higher expectations than we have been used to.  Today's customers want performance, and they want it now! "
59,3,"Barrel of Monkeys, 2004 Edition: Notes on Philippine Elections","Well, it's election time in the Republic of the Philippines, and that means the monkeys are rolling around in those political barrels, having as much fun as they can while laughing their heads off at the strange goings-on that characterize a democratic process loosely based on the American model  but that de facto looks more like a Fellini movie crossed with a Tom and Jerry cartoon - column includes a useful election-year glossary!"
60,3,Oldsmobile: The final parking lot,"Why General Motors dropped the Oldsmobile. The four brand  paradoxes GM had to face - the name, the product, image re-positioning, and the consumer - all added up to a brand that had little hope of rebranding."
61,3,"Not All Jobs Belong To The White Man: Asian Minorities, Affirmative Action, And The Quest For Parity At Work","Although a smattering of Chinese, Filipinos, Japanese, Indians, Thais, and others may crow about seeing their kind sitting in prominent positions in corporations and organizations in the USA, these accomplishments become mere cultural high-fives and ritualistic chest-thumping goaded and impishly patronized by 'mainstream society' - the milder and gentler term for the white-dominated populace."
62,3,"Downhome Pinoy Blues, Intersecting Life Paths, and Heartbreak Songs","The Blues is alive and well in the Philippines, as evidenced by this appreciation of the Pinoy Blues band 'Lampano Alley', penned by columnist Clarence Henderson as a counterpoint to his usual economics, business, and culture fare."
63,3,The Real Time Modern Manila Blues: Bill Monroe Meets Muddy Waters in the Orient,"Globalization does strange things to people. A day in the life of a Manila Philippines based business consultant - proving that you really CAN talk about Muddy Walters, bluegrass and work all on the same page..."
64,3,Best Asian Tourism Destinations,"The new APMF survey of the best Asian tourism destinations has just kicked off, but it's crowded at the top, with Chiang Mai in Thailand just leading from perennial favourites Hong Kong, Bangkok and Phuket in Thailand, and Bali in  Indonesia. Be one of the first to vote and let us know your reasons."
65,3,What are the best cities for business in Asia?,"One of our new categories in the APMF Sense of Place survey is for best Asian business city. After a couple of days, Singapore leads the pack, followed by Bangkok, Thailand and Hong Kong. Enter your vote and comments and make your views count. More new categories include best city for livability, and best tourism destinations."
66,3,IT alligator tales,"I grew up in New York, where giant alligators -- sometimes more ornately described as albino alligators -- were rumored to roam the citys sewer systems. According to legend, vacationers picked up the tiny crocodilians in Florida, brought them home to New York, and eventually flushed the little buggers when they grew too big for the local concrete jungle."
67,3,IT Myth 5: Most IT projects fail,"Do most IT projects fail? Some point to the number of giant consultancies such as IBM Global Services, Capgemini, and Sapient, who feed off bad experiences encountered by enterprises. Sapient is a company founded on the realization that IT projects are not successful, says Sapient CTO Ben Gaucherin."
68,3,BEA grabs CA exec to head product group,BEA Systems Inc. has hired the Computer Associates International Inc. executive responsible for CA's Unicenter line of enterprise management software to head BEA's product development group.
69,3,Autodesk tackles project collaboration,"Autodesk  this week unwrapped an updated version of its hosted project collaboration service targeted at the construction and manufacturing industries. Autodesk Buzzsaw lets multiple, dispersed project participants -- including building owners, developers, architects, construction teams, and facility managers -- share and manage data throughout the life of a project, according to Autodesk officials."
70,3,U.K.'s NHS taps Gartner to help plan \$9B IT overhaul,"LONDON -- The U.K.'s National Health Service (NHS) has tapped IT researcher Gartner Inc. to provide market intelligence services as the health organization forges ahead with a mammoth, 5 billion (\$9.2 billion) project to upgrade its information technology infrastructure."
71,3,Play Boys: Google IPO a Go Anyway,"Even though Google's two founders gave an interview to Playboy magazine in the midst of its IPO filing, the SEC allowed the company's offering to go ahead. The boys filed the interview with the SEC and corrected mistakes in it."
72,3,More Big Boobs in Playboy,An interview with Google's co-founders due out in the current issue of Playboy may delay the company's IPO. Securities regulations restrict what executives can say while preparing to sell stock for the first time.
73,3,Dutch Firm Beats Apple to Punch,A music retailer from the Netherlands beats Apple by launching a download service in Europe's latest market battleground. Also: Movie industry wrests agreement from defunct company.... Microsoft challenges Photoshop   hellip;. and more.
74,3,HP to Buy Synstar,Hewlett-Packard will pay \$297 million for the British company. Also: TiVo goes all out to attract customers   hellip;. Sprint offers service guarantees for business wireless subscribers   hellip;. and more.
75,3,A Personal Operator From Verizon,"Verizon plans to offer a service that would act as a virtual switchboard operator, letting customers stay in touch at all times. The program would send phone calls, voicemails and e-mails wherever customers designate. By Elisa Batista."
76,3,Paid Search Growth May Slow,A new Internet advertising forecast shows a slowdown in paid search listings in the next five years. Will the projection affect Google's prospects when it goes public?
77,3,Fark Sells Out. France Surrenders,"Blogs are the hottest thing on the Net, but are they messing with traditional publishing principles? One of the most popular, Fark.com, is allegedly selling links. Is it the wave of the future? By Daniel Terdiman."
78,4,"'Madden,' 'ESPN' Football Score in Different Ways (Reuters)","Reuters - Was absenteeism a little high\on Tuesday among the guys at the office? EA Sports would like\to think it was because ""Madden NFL 2005"" came out that day,\and some fans of the football simulation are rabid enough to\take a sick day to play it."
79,4,Group to Propose New High-Speed Wireless Format (Reuters),"Reuters - A group of technology companies\including Texas Instruments Inc. (TXN.N), STMicroelectronics\(STM.PA) and Broadcom Corp. (BRCM.O), on Thursday said they\will propose a new wireless networking standard up to 10 times\the speed of the current generation."
80,4,AOL to Sell Cheap PCs to Minorities and Seniors (Reuters),Reuters - America Online on Thursday said it\plans to sell a low-priced PC targeting low-income and minority\households who agree to sign up for a year of dialup Internet\service.
81,4,Companies Approve New High-Capacity Disc Format (Reuters),"Reuters - A group of consumer electronics\makers said on Wednesday they approved the format for a new\generation of discs that can store five times the data of DVDs\at the same cost -- enough to put a full season of ""The\Sopranos"" on one disc."
82,4,Missing June Deals Slow to Return for Software Cos. (Reuters),Reuters - The mystery of what went wrong for the\software industry in late June when sales stalled at more than\20 brand-name companies is not even close to being solved\although the third quarter is nearly halfway over.
83,4,Hacker Cracks Apple's Streaming Technology (AP),AP - The Norwegian hacker famed for developing DVD encryption-cracking software has apparently struck again  #151; this time breaking the locks on Apple Computer Inc.'s wireless music streaming technology.
84,4,European Download Services Go Mobile (Reuters),Reuters - The ability to download complete\tracks directly over cell-phone networks to mobile phones is\becoming a reality in Europe.
85,4,Open Source Apps Developer SugarCRM Releases Sugar.Sales 1.1 (TechWeb),"TechWeb - News - August 13, 2004"
86,4,Oracle Sales Data Seen Being Released (Reuters),"Reuters - Oracle Corp. sales documents\detailing highly confidential information, such as which\companies receive discounts on Oracle's business software\products and the size of the discounts, are likely to be made\public, a federal judge said on Friday."
87,4,Sun's Looking Glass Provides 3D View (PC World),PC World - Developers get early code for new operating system 'skin' still being crafted.
88,4,Apple to open second Japanese retail store this month (MacCentral),"MacCentral - Apple Computer Inc. will open its second Japanese retail store later this month in the western Japanese city of Osaka, it said Thursday."
89,4,Charley's Force Took Experts by Surprise (AP),AP - Hurricane Charley's 145-mph force took forecasters by surprise and showed just how shaky a science it still is to predict a storm's intensity  #151; even with all the latest satellite and radar technology.
90,4,"Science, Politics Collide in Election Year (AP)","AP - With more than 4,000 scientists, including 48 Nobel Prize winners, having signed a statement opposing the Bush administration's use of scientific advice, this election year is seeing a new development in the uneasy relationship between science and politics."
91,4,Building Dedicated to Columbia Astronauts (AP),"AP - A former dormitory converted to classrooms at the Pensacola Naval Air Station was dedicated Friday to two Columbia astronauts who were among the seven who died in the shuttle disaster Feb. 1, 2003."
92,4,Russian Cargo Craft Docks at Space Station (AP),"AP - A Russian cargo ship docked with the international space station Saturday, bringing food, water, fuel and other items to the two-man Russian-American crew, a space official said."
93,4,Bangkok's Canals Losing to Urban Sprawl (AP),"AP - Along the banks of the canal, women in rowboats grill fish and sell fresh bananas. Families eat on floating pavilions, rocked gently by waves from passing boats."
94,4,"T. Rex Had Teen Growth Spurt, Scientists Say (Reuters)","Reuters - Tyrannosaurus Rex grew incredibly fast\during a teenaged growth spurt that saw the dinosaur expand its\bulk by six times, but the fearsome beasts ""lived fast and died\young,"" researchers said on Wednesday."
95,4,Gene Blocker Turns Monkeys Into Workaholics - Study (Reuters),"Reuters - Procrastinating monkeys were turned\into workaholics using a gene treatment to block a key brain\compound, U.S. researchers reported on Wednesday."
96,4,Dolphins Too Have Born Socialites (Reuters),Reuters - Some people are born to be the life and\soul of the party -- and so it seems are some dolphins.
97,4,"What's in a Name? Well, Matt Is Sexier Than Paul (Reuters)","Reuters - As Shakespeare said, a rose by any other\name would smell as sweet. Right?"
98,4,UK Scientists Allowed to Clone Human Embryos (Reuters),"Reuters - British scientists said on Wednesday\they had received permission to clone human embryos for medical\research, in what they believe to be the first such license to\be granted in Europe."
99,4,"Russian Alien Spaceship Claims Raise Eyebrows, Skepticism (SPACE.com)",SPACE.com - An expedition of Russian researchers claims to have found evidence that an \  alien spaceship had something to do with a huge explosion over Siberia in 1908. \  Experts in asteroids and comets have long said the massive blast was caused \  by a space rock.
100,4,"Comets, Asteroids and Planets around a Nearby Star (SPACE.com)","SPACE.com - A nearby star thought to harbor comets and asteroids now appears to be home to planets, too. The presumed worlds are smaller than Jupiter and could be as tiny as Pluto, new observations suggest."
101,4,Perseid Meteor Shower Peaks Overnight (SPACE.com),SPACE.com - A fine display of shooting stars is underway and peaks overnight Wednesday into early Thursday morning. Astronomers expect the 2004 Perseid meteor shower to be one of the best versions of the annual event in several years.
102,4,Redesigning Rockets: NASA Space Propulsion Finds a New Home (SPACE.com),"SPACE.com - While the exploration of the Moon and other planets in our solar system is nbsp;exciting, the first task for astronauts and robots alike is to actually nbsp;get to those destinations."
103,4,Studies Find Rats Can Get Hooked on Drugs (AP),"AP - Rats can become drug addicts. That's important to know, scientists say, and has taken a long time to prove. Now two studies by French and British researchers show the animals exhibit the same compulsive drive for cocaine as people do once they're truly hooked."
104,4,NASA Chief: 'Let's Go Save the Hubble' (SPACE.com),"SPACE.com - Amid uncertainty over the fate of the Hubble Space Telescope and with a key instrument not working, NASA Administrator Sean O'Keefe gave the go-ahead Monday for planning a robotic servicing mission."
105,4,Armadillo Aerospaces X Prize Prototype Crashes (SPACE.com),"SPACE.com - Armadillo Aerospace of Mesquite, Texas has reported a \crash last weekend of their prototype X Prize rocket."
106,4,Prairie Dog Won't Be on Endangered List (AP),AP - The black-tailed prairie dog has been dropped from a list of candidates for the federal endangered species list because scientists have concluded the rodents are no longer threatened.
