,ClassIndex,Title,Description
180,4,Kerry's Disgusting Ad,"\\A few days ago Kerry sent around this ad:\\""Yesterday, the Bush-Cheney campaign, losing any last sense of decency, placed\a disgusting ad called ""The Faces of John Kerry's Democratic Party"" as the\main feature on its website. Bizarrely, and without explanation, the ad places\Adolf Hitler among those faces.""\\""The Bush-Cheney campaign must pull this ad off of its website. The use of\Adolf Hitler by any campaign, politician or party is simply wrong.""\\Which of course is a mistake.  I went and downloaded the video (which is just\stupid btw.  Not a masterpiece by any means.) and there are shots of Hitler in\there, but only from the MoveOn contest from a few months back.\\Here's the problem.  The ...\\"
181,4,What would Baby Jesus Think?,"\\""On Tuesday, Cheney, serving in his role as president of the Senate, appeared in\the chamber for a photo session. A chance meeting with Sen. Patrick J. Leahy\(Vt.), the ranking Democrat on the Judiciary Committee, became an argument about\Cheney's ties to Halliburton Co., an international energy services corporation,\and President Bush's judicial nominees. The exchange ended when Cheney offered\some crass advice.\\'Fuck yourself,' said the man who is a heartbeat from the presidency.""\\Wonder what the moral majority has to say about this?\\It isn't profanity!  Its a freedom praise!\\"
182,4,Americans and Freedom,"\\""When we Americans first began, our biggest danger was clearly in view: we knew\from the bitter experience with King George III that the most serious threat to\democracy is usually the accumulation of too much power in the hands of an\Executive, whether he be a King or a president. Our ingrained American distrust\of concentrated power has very little to do with the character or persona of the\individual who wields that power. It is the power itself that must be\constrained, checked, dispersed and carefully balanced, in order to ensure the\survival of freedom. In addition, our founders taught us that public fear is the\most dangerous enemy of democracy because under the right circumstances it ...\\"
183,4,Why Windows isn't Unix,"\\""I first heard about this from one of the developers of the hit game SimCity, who\told me that there was a critical bug in his application: it used memory right\after freeing it, a major no-no that happened to work OK on DOS but would not\work under Windows where memory that is freed is likely to be snatched up by\another running application right away. The testers on the Windows team were\going through various popular applications, testing them to make sure they\worked OK, but SimCity kept crashing. They reported this to the Windows\developers, who disassembled SimCity, stepped through it in a debugger, found\the bug, and added special code that checked if SimCity was running, and if it\did ...\\"
184,4,"Microsoft, IE and Bloat","\\Zawodny  threads off of Scoble  on the IE issue:\\""I have to say, when I first read that I nearly fell off my chair laughing. I was\thinking ""how stupid ARE these IE guys?!?!?!"" But we all know that Microsoft is\full of smart people who care about what they're doing. So something really\doesn't compute here.""\\""Last time I checked, IE wasn't even close to feature parity with Mozilla's\browsers. No popup blocking, no tabbed browsing, etc.""\\""Does the IE team really not know what their product is missing?""\\Perhaps.  It's highly likely that they just don't know.\\The bigger issue here is that Microsoft products can't fail and they can't\succeed.  Microsoft has 40-50 billion in the bank.  There ...\\"
185,4,"DRM is doubleplus good for business, Congress advised",The Budget Office and the case of the disappearing public interest
186,4,HP: The Adaptive Enterprise that can't adapt,&lt;strong&gt;Opinion&lt;/strong&gt; SAP hardly to blame
187,4,Buffy the Censor Slayer,&lt;strong&gt;Letters&lt;/strong&gt; Readers drive stake through parents' group
188,4,Ashlee Vance: the readers have spoken,&lt;strong&gt;Poll results&lt;/strong&gt; Bright news for resident &lt;em&gt;Reg&lt;/em&gt; ladyboy
189,4,&lt;em&gt;El Reg&lt;/em&gt; pledges to name BSA antipiracy weasel,&lt;strong&gt;Competition&lt;/strong&gt; Get those suggestions in
190,4,Wireless net to get speed boost,Wireless computer networks could soon be running 10 times faster than they do now.
191,4,Watchdog rules over broadband ,The UK's ad watchdog rules over which net connections can be described as full speed broadband.
192,4,GameBoy mini-games win prize,A set of GameBoy micro-games is named as the most innovative game of the year at a festival in Scotland.
193,4,Microsoft takes down SP2 sharers,Microsoft is stopping people getting hold of a key security update via net-based file- sharing systems.
194,4,Long-awaited Doom 3 hits the UK,Doom 3 goes on sale in the UK at a time of renewed concerns over violence in video games.
195,4,Britons embrace digital lifestyle,"People in the UK are spending more time and money going digital, says communications watchdog Ofcom."
196,4,PlayStation potential to learning,"The PlayStation games console could be developed into a learning tool for children, says a Northumberland head teacher."
197,4,'Invisible' technology for Olympics,Getting the technology in place for Athens 2004 is an Olympic task in itself.
198,4,Satellite boosts Olympic security,An enhanced satellite location system aims to help Olympic security guards react more quickly to emergencies.
199,4,3D holograms to crack forgeries,A 3D hologram technique could transform how experts spot forged signatures and other handwritten documents.
200,4,Video games 'good for children',"Computer games can promote problem-solving and team-building in children, say games industry experts."
201,4,Fake goods tempting young adults,"Young people are increasingly happy to buy pirated goods or illegal download content from the net, a survey shows."
202,4,Catwoman far from perfect,The Catwoman game is a major disappointment that feels like a pointless tie-in with the film.
203,4,"'Madden,' 'ESPN' Football Score in Different Ways"," PROVIDENCE, R.I. (Reuters) - Was absenteeism a little high  on Tuesday among the guys at the office? EA Sports would like  to think it was because ""Madden NFL 2005"" came out that day,  and some fans of the football simulation are rabid enough to  take a sick day to play it."
204,4,AOL to Sell Cheap PCs to Minorities and Seniors, NEW YORK (Reuters) - America Online on Thursday said it  plans to sell a low-priced PC targeting low-income and minority  households who agree to sign up for a year of dialup Internet  service.
205,4,Microsoft to Introduce Cheaper Version of Windows," SEATTLE (Reuters) - Microsoft Corp. &lt;MSFT.O&gt; said it will  begin selling a stripped-down, low-cost version of its Windows  XP operating system in the emerging markets of Indonesia,  Malaysia and Thailand in order to spread the use of computing  and develop technology markets."
206,4,Companies Approve New High-Capacity Disc Format," LOS ANGELES (Reuters) - A group of consumer electronics  makers said on Wednesday they approved the format for a new  generation of discs that can store five times the data of DVDs  at the same cost -- enough to put a full season of ""The  Sopranos"" on one disc."
207,4,Missing June Deals Slow to Return for Software Cos., NEW YORK (Reuters) - The mystery of what went wrong for the  software industry in late June when sales stalled at more than  20 brand-name companies is not even close to being solved  although the third quarter is nearly halfway over.
208,4,Microsoft Upgrades Software for Digital Pictures, SEATTLE (Reuters) - Microsoft Corp. &lt;MSFT.O&gt; released on  Tuesday the latest version of its software for editing and  organizing digital photographs and images to tap into  widespread demand for digital cameras and photography.
209,4,Google to Pay Yahoo to Settle Patent Dispute," SEATTLE (Reuters) - Google Inc. &lt;GOOG.O&gt; on Monday again  boosted the number of shares it plans to sell in its initial  public offering, saying it will issue 2.7 million shares to  Yahoo Inc. &lt;YHOO.O&gt; to settle a lawsuit over technology used to  display ads."
210,4,A Digital Doctor Treats Computer Contamination,"Unfortunately for users, computer equipment manufacturers and resellers don't adequately inform Windows users of the risks involved in accessing the Internet without proper security measures.&lt;br&gt;&lt;FONT face=""verdana,MS Sans Serif,arial,helvetica"" size=""-2""\ color=""#666666""&gt;&lt;B&gt;-The Washington Post&lt;/b&gt;&lt;/font&gt;"
211,4,'SP2' a Must With XP Use,"Service Pack 2, ""SP2"" for short, aims to stop viruses, worms, browser hijackings and worse by including security features that people have to add and adjust on their own. &lt;FONT face=""verdana,MS Sans Serif,arial,helvetica"" size=""-2""\ color=""#666666""&gt;&lt;B&gt;-Rob Pegoraro&lt;/b&gt;&lt;/font&gt;"
212,4,Putting Your Own Stamp On All Your Parcels,"Fido the Stamp is here. Well, he could be -- all it takes is for one dog owner to snap a digital photo of his beloved pooch, submit it to the Stamps.com Web site and order personalized postage. &lt;FONT face=""verdana,MS Sans Serif,arial,helvetica"" size=""-2""\ color=""#666666""&gt;&lt;B&gt;-Leslie Walker&lt;/b&gt;&lt;/font&gt;"
213,4,Internet Challenges Face-to-Face Mingling,"At Bungalow Billiards in Chantilly on Wednesday, about a dozen single parents from Northern Virginia gathered at happy hour to mingle, eat and drink. All were divorced or widowed members of the Fairfax chapter of Parents Without Partners."
214,4,Forecast: Plenty of Activity On the Weather Blog Front,"If it's possible to love something just because it could visit torrents upon the Washington region, fling hail from the skies and swell streams into rivers, then Jason Samenow is smitten."
215,4,Google Starts Auction,"Company launched the biggest electronic auction of stock in Wall Street history Friday but warned that it could face legal liability from a Playboy magazine interview in which some aspects of the Internet search engine's performance were overstated. &lt;FONT face=""verdana,MS Sans Serif,arial,helvetica"" size=""-2""\ color=""#666666""&gt;&lt;B&gt;-The Washington Post&lt;/b&gt;&lt;/font&gt;"
216,4,Bids Placed Despite Mixed News,"Umesh Patel, a 36-year old software engineer from California, debated until the last minute."
217,4,Antitrust Lawyer Takes Helm at FTC,"As Deborah P. Majoras takes over the Federal Trade Commission on Monday, she's expected to build on the broad agenda set by her predecessor, Timothy J. Muris."
218,4,GAO Calls Stryker Too Heavy for Transport,"The Army's new medium-weight armored vehicle, the Stryker, weighs so much that it curtails the range of C-130 military cargo aircraft that carry it and under certain conditions make it impossible for the planes to take off, a new report for Congress found."
219,4,BioVeris Settles 2 Lawsuits Against Chief Executive's Son,"BioVeris Corp. announced yesterday that it settled two lawsuits against Jacob N. Wohlstadter, its chief executive's son, whom the company had accused of spending millions of dollars on cars and real estate to sabotage a joint venture he ran so he could purchase it for a bargain price."
220,4,Google: Now Playboy's Latest Bunny,"Investors in the company that's trying to come off as cute as a bunny could find themselves holding a fistful of vipers if the founders of Google Inc. continue to do things like show up in Playboy magazine around the same time their company is going public. &lt;FONT face=""verdana,MS Sans Serif,arial,helvetica"" size=""-2""\ color=""#666666""&gt;&lt;B&gt;-washingtonpost.com&lt;/B&gt;&lt;/FONT&gt;"
221,4,EBay Buys Stake in Craigslist,"Internet auctioneer eBay Inc. said Friday it acquired a 25 percent stake in craigslist, an online community of classified ads and forums. &lt;FONT face=""verdana,MS Sans Serif,arial,helvetica"" size=""-2""\ color=""#666666""&gt;&lt;B&gt;-Associated Press&lt;/B&gt;&lt;/FONT&gt;"
222,4,Blog Interrupted,"The instant message blinked on the computer at Jessica Cutler's desk in the Russell Senate Office Building. ""Oh my God, you're famous."""
223,4,Hungry world 'must eat less meat',"People will need to eat more vegetables and less meat because of dwindling water supplies, scientists say."
224,4,Hopes soar for solo record plane,Richard Branson says the Virgin Global Flyer is looking good for its solo trip around the world without refuelling.
225,4,Arctic team reaches destination,"A team of British explorers, who are retracing the steps of a Victorian  pioneer, have reached Thom Bay."
226,4,Shuttle camera to watch fuel tank,"The space shuttle's external fuel tank, implicated in the 2003 Columbia disaster, is to get its own camera."
227,4,Hubble peers at celestial bubble,The Hubble Space Telescope has looked into a bubble of gas and dust being inflated by a young star's particles.
228,4,Bacteria gives coral orange glow,"Orange coral common to the Caribbean has bacteria to thank for its hue, say US marine scientists."
229,4,Honey bees close museum ,A Worcestershire museum is forced to close for several weeks while a swarm of honey bees is removed.
230,4,Clouds dash Perseids show,"The annual Perseid meteor shower could provide a ""spectacular"" show, despite a disappointing start."
231,4,Worms may slow Parkinson's,A protein which helps increase lifespan in worms offers hope for new Parkinson's and Alzheimer's treatments.
232,4,Nasa help for stem cell study,UK tissue engineering experts are teaming up with NASA to find treatments for diseases back on Earth.
233,4,TB test to slash infection rates,"A rapid and accurate test for TB could cut infection rates around the world, say experts."
234,4,Scientists given cloning go-ahead,The first request by British scientists to clone human embryos has been granted by experts.
235,4,Vandals damage bird reserve,A disturbance free zone for nesting birds is put at risk by vandals who cut down the boundary fence.
236,4,Heat waves set to become 'brutal',"Heat waves in the 21st Century will be more intense, more frequent and longer, US experts say."
237,4,Monkeys test 'hardworking gene',Scientists in the United States find a way to turn lazy monkeys into workaholics using gene therapy.
238,4,Hearing clue to whale evolution,"The evolution of whales from four-legged land dwellers into streamlined swimmers has been traced in fossilised ears, Nature reports."
239,4,News: NASA Extends TRMM Operations Through 2004 Hurricane Season,"NASA will extend operation of the Tropical Rainfall\Measuring Mission (TRMM) through the end of 2004, in light of a\recent request from the National Oceanic and Atmospheric\Administration (NOAA)."
240,4,News: Climate Change Could Doom Alaska's Tundra,"In the next 100 years, Alaska will experience a massive loss of its historic tundra, as global warming allows these vast regions of cold, dry, lands to support forests and other vegetation that will dramatically alter native ecosystems. (Oregon State University press release)"
241,4,News: How Strongly Does the Sun Influence the Climate?,"Researchers have shown that the Sun can be responsible for, at most, only a small part of the warming over the last 20-30 years. (Max Planck Society press release)"
242,4,News: New England Forests at Greater Risk from Air Pollution,"When it comes to forests, air pollution is not an equal opportunity hazard. While dirty air spreads across large areas of the New England region, it's more scattered in the southeastern part of the United States. (University of Wisconsin-Madison press release)"
243,4,"News: Warmer Weather, Human Disturbances Interact to Change Forests","While a rapidly changing climate may alter the composition of northern Wisconsin's forests, disturbances such as logging also will play a critical role in how these sylvan ecosystems change over time. (University of Wisconsin-Madison press release)"
244,4,News: Duke Study Disputes Idea that Trees Can 'Relocate' Quickly in Response to Climate Change,"In a study with implications for how North American trees might respond to a changing climate, molecular information collected by Duke University researchers refutes a widely accepted theory that many of the continent's tree species migrated rapidly from the deep South as glaciers retreated at the end of the last Ice Age. (Duke University press release)"
245,4,"News: Droughts Like 1930s Dust Bowl May Have Been Unexceptional in Prehistoric Times, New Study Suggests","Events like the great Dust Bowl of the 1930s, immortalized in ""The Grapes of Wrath"" and remembered as a transforming event for millions of Americans, were regular parts of much-earlier cycles of droughts followed by recoveries in the region, according to new studies by a multi-institutional research team led by Duke University. (Duke University press release)"
246,4,News: New Study to Investigate Demise of Coral Reef Ecosystems,"Scientists are embarking on a project which will explore how global warming is devastating one of the world's most diverse ecosystems, coral reefs. (University of Newcastle press release)"
247,4,Natural Hazards: Typhoon Rananim,The MODIS instrument aboard NASA's Terra satellite captured this true-color image of Typhoon Rananim on August 12 at 2:40 UTC.
248,4,Horseflies and Meteors,"Like bugs streaking colorfully down the side window of a moving car, Earthgrazing Perseid meteors could put on a pleasing show after sunset on August 11th."
249,4,Spinning Brains,"One day, astronauts could zip across the solar system in spinning spaceships.  How will their brains adapt to life onboard a twirling home where strange  quot;Coriolis forces quot; rule?"
250,4,What Neil   Buzz Left on the Moon,A cutting-edge Apollo 11 science experiment left behind in the Sea of Tranquility is still running today.
251,4,"Voyager 1, Prepare for Action","At the outer limits of our solar system, a solar shock wave is about to overtake NASA's Voyager 1 spacecraft."
252,4,Saturn Hailstorm,"When Cassini reached Saturn On June 30th, it dashed through a gap in Saturn's rings, twice. One of onboard science instruments recorded a flurry of ring-dust harmlessly striking the spacecraft.\\"
253,4,Dino-Size Spurt: T. Rex Teens Gained 5 Pounds a Day,"New analysis of fossil bones indicates that adolescent &lt;i&gt;Tyrannosaurus rex&lt;/i&gt; dinosaurs grew extremely rapidly, quickly reaching gigantic size."
254,4,Fossils Show How Whales Evolved to Hear Underwater,Whale fossils found with tiny ear bones reveal for the first time how the ancestors of whales and dolphins developed their acute underwater hearing.
255,4,"Real ""Danny Deckchairs"" Soar With Just a Seat and Some Balloons","In the new movie &lt;i&gt;Danny Deckchair,&lt;/i&gt; a truck driver ties party balloons to a chair and flies away. It's called cluster ballooning, and believe it or not, it's a real sport."
256,4,"""Unusually Good"" Meteor Shower Expected Tonight","Tonight's annual Perseid meteor shower is likely to be a spectacular show of shooting stars zipping across the night sky, according to astronomers."
257,4,"""Monster"" Waves Suprisingly Common, Satellites Show",Rogue waves #151;eight or more stories or higher #151;are freaks of the ocean once thought to be tall tales told by sailors. But now scientists have satellite evidence that the massive upwellings are not only real but also fairly common.
258,4,"Ancient Olympians Followed ""Atkins"" Diet, Scholar Says",What did the first Olympians eat? Food historians are scouring ancient texts to find out.
259,4,U.S. Warrior Arms Africans to Hunt Sudanese Poachers,"Armed poachers from Sudan have been raiding and destroying neighboring Central African Republic's wildlife resources for years. Now, with the help of a militant U.S. conservationist, the CAR populace is arming and training itself to fight back."
260,4,"Ancient Olympics Mixed Naked Sports, Pagan Partying","Nude athletes, performance-enhancing lizard meat, and animal sacrifices are just a few of the things that separate the ancient Olympics from the modern games, says the author of &lt;i&gt;The Naked Olympics.&lt;/i&gt;"
261,4,Travel Column: Offsetting Air Travel's Greenhouse Impact,"Global warming is threatening travel destinations worldwide. What's more, travelers themselves are contributing to it. Find out what you can do about it."
262,4,"Magma Surge Moves Nevada Mountain, Study Says","Why did a Lake Tahoe-area peak move dramatically late last year? A new report says magma deep below surged upward, forcing the mountain to rise."
263,4,266 Chimps From Lab Adopted by Florida Refuge,"With an influx of chimps previously used as laboratory animals, Florida's Center for Captive Chimpanzee Care is transforming into the largest chimp sanctuary in the world #151;almost overnight."
264,4,Locusts Inspire Technology That May Prevent Car Crashes,"Locusts are commonly associated with plagues, food shortages, and death. But they are also inspiring what may be the next wave in lifesaving collision-avoidance systems."
265,4,Progress Supply Ship Docks with Space Station,"NASA -- An unpiloted Russian cargo ship linked up the International Space Station this morning to deliver almost three tons of food, fuel, oxygen, water and supplies to the residents onboard.     The ISS Progress 15 craft automatically docked to the aft port of the Zvezda Service Module at 12:01 a.m..."
266,4,Building Dedicated to Space Shuttle Columbia Astronauts,"By BILL KACZOR    PENSACOLA, Fla. (AP) -- A former dormitory converted to classrooms at the Pensacola Naval Air Station was dedicated Friday to two Columbia astronauts who were among the seven who died in the shuttle disaster Feb..."
267,4,Undersea Habitat Becomes Experimental Space Hospital,"NASA -- The days of doctors making house calls may seem like ancient history for most patients in North America, but in October, three astronauts and a Canadian doctor will test the latest concepts in long-distance house calls using a unique underwater laboratory.     The ability to conduct long-distance health care such as telemonitoring and telerobotic surgery could be key to maintaining the wellness of future spacefarers and responding to medical emergencies on the International Space Station, the moon or Mars..."
268,4,How Mars Fooled the World,"The famous Orson Welles' radio broadcast of ""The War of the Worlds"" is about to hit the big screen, as film moguls Spielberg and Cruise bring the H.G. Wells' classic back into the popular imagination. Are we so clever today not be duped?"
269,4,Chandra Catches Early Phase of Cosmic Assembly,Chandra X-Ray Observatory -- A NASA Chandra X-ray Observatory image has revealed a complex of several intergalactic hot gas clouds in the process of merging.     The superb Chandra spatial resolution made it possible to distinguish individual galaxies from the massive clouds of hot gas...
270,4,Hubble Peers Inside a Celestial Geode,"Hubble Space Telescope -- In this unusual image, NASA's Hubble Space Telescope captures a rare view of the celestial equivalent of a geode  a gas cavity carved by the stellar wind and intense ultraviolet radiation from a hot young star.    Real geodes are baseball-sized, hollow rocks that start out as bubbles in volcanic or sedimentary rock..."
271,4,Saturn's Moon Titan: Prebiotic Laboratory,"by Harry Bortman    In this second and final part of the interview, Lunine explains how Huygens may help scientists understand the origin of life on Earth, even if it doesn't detect life on Titan.    Astrobiology Magazine -- Titan is the only moon in our solar system with an atmosphere, and it is the organic chemistry that has been detected in that atmosphere that has sparked the imagination of planetary scientists like Lunine..."
272,4,Sharpest Image Ever Obtained of a Circumstellar Disk Reveals Signs of Young Planets,"MAUNA KEA, Hawaii -- The sharpest image ever taken of a dust disk around another star has revealed structures in the disk which are signs of unseen planets.     Dr..."
273,4,Chandra Celebrates Five Years of Scientific Breakthroughs,"Marshall Space Flight Center -- On August 12, 1999, NASA's Chandra X-ray Observatory opened its sunshade doors for the first time, allowing celestial X-ray light to reach the observatory's mirrors. This one small step for the observatory proved to be a giant leap for science as Chandra began its mission to shed new light on a violent, mysterious universe invisible to the human eye..."
274,4,Some Globular Clusters May Be Leftovers From Snacking Galaxies,"Globular star clusters are like spherical cathedrals of light -- collections of millions of stars lumped into a space only a few dozen light-years across. If the Earth resided within a globular cluster, our night sky would be alight with thousands of stars more brilliant than Sirius."
275,4,India Rethinks Plan for Manned Moon Mission,"By S. SRINIVASAN    BANGALORE, India (AP) -- India is rethinking its plan to send a man to the moon by 2015, as the mission would cost a lot of money and yield very little in return, the national space agency said Thursday..."
276,4,Cluster Finds Giant Gas Vortices at the Edge of Earths Magnetic Bubble,"European Space Agency -- ESAs quartet of space-weather watchers, Cluster, has discovered vortices of ejected solar material high above the Earth.     The superheated gases trapped in these structures are probably tunnelling their way into the Earths magnetic bubble, the magnetosphere..."
277,4,Saturn's Moon Titan: Planet Wannabe,"by Henry Bortman     Jonathan Lunine, professor of planetary science and physics at the University of Arizona's Lunar and Planetary Laboratory in Tucson, Arizona, has long been fascinated by Saturn's largest moon, Titan. In this first part of the interview, Lunine explains what scientists hope to learn from Huygens..."
