,ClassIndex,Title,Description
107,4,Hubble Trouble: One of Four Instruments Stops Working (SPACE.com),SPACE.com - One of the four astronomical instruments on the Hubble Space Telescope shut down earlier this week and engineers are trying to pin down the problem. The other three instruments continue to operate normally.
108,4,Invasive Purple Weed May Meet Its Match (AP),"AP - They burned it, mowed it, sprayed it and flooded it. But nothing killed the purple loosestrife weed, which has become a regional plague, until officials at the Parker River National Wildlife Refuge set a European beetle loose on it."
109,4,New NASA Supercomputer to Aid Theorists and Shuttle Engineers (SPACE.com),SPACE.com - NASA researchers have teamed up with a pair of Silicon Valley firms to build \  a supercomputer that ranks alongside the world's largest Linux-based systems.
110,4,Ants Form Supercolony Spanning 60 Miles (AP),"AP - Normally clannish and agressive Argentine ants have become so laid back since arriving in Australia decades ago that they no longer fight neighboring nests and have formed a supercolony here that spans 60 miles, scientists say."
111,4,Viewer's Guide: Perseid Meteor Shower Peaks Aug. 11-12 (SPACE.com),"SPACE.com - Every August, when many \  people are vacationing in the country where skies are dark, the best-known meteor \  shower makes its appearance. The annual Perseid meteor shower, as it is called, \  promised to put on an above average display this year."
112,4,Rescuers Free Beached Whale in Brazil (AP),"AP - Rescuers succeeded in freeing a minke whale that washed up on a beach in southeastern Brazil, the fire department said Thursday."
113,4,Red-Footed Falcon Sighted in Mass. (AP),AP - A red-footed falcon spotted for the first time in North America is enticing birdwatchers to Martha's Vineyard.
114,4,Weak Version of Most Powerful Explosions Found (SPACE.com),"SPACE.com - Gamma-ray bursts are the most powerful events in the universe, temporary outshining several galaxies and likely signaling the birth of a black hole."
115,4,Simultaneous Tropical Storms a Rarity (AP),AP - The prospect that a tropical storm and a hurricane  #151; or possibly two hurricanes  #151; could strike Florida on the same day is something meteorologists say they have never seen.
116,4,NASA's Genesis Spacecraft Adjusts Course (AP),"AP - NASA's Genesis spacecraft successfully adjusted its course this week as it heads back toward Earth with a sample of solar wind particles, the space agency said Wednesday."
117,4,"Earth is Rare, New Study Suggests (SPACE.com)","SPACE.com - Flip a coin. Heads, Earth is a common sort of planet. Tails, and ours is as unusual as a coin landing on edge. That's about the state of knowledge for scientists who ponder the question of our planet's rarity."
118,4,Scientists Probe Pacific for Dead Zone (AP),"AP - His hand on a toggle switch and his eyes on a computer screen, Oregon State University graduate student Anthony Kirincich uses an array of scientific instruments to probe the vibrant waters of the Pacific. He is searching for the absence of life."
119,4,"Life on Mars Likely, Scientist Claims (SPACE.com)","SPACE.com - DENVER, COLORADO -- Those twin robots hard at work on Mars have transmitted teasing views that reinforce the prospect that microbial life may exist on the red planet."
120,4,India Rethinks Plan to Send Man to Moon (AP),"AP - India is rethinking its plan to send a man to the moon by 2015, as the mission would cost a lot of money and yield very little in return, the national space agency said Thursday."
121,4,Natural Sunblock: Sun Dims in Strange Ways (SPACE.com),"SPACE.com - When Venus crossed the Sun June 8, showing up as a clear black dot to the delight of millions of skywatchers around the world, astronomers noted something less obvious: The amount of sunlight reaching Earth dipped by 0.1 percent for a few hours."
122,4,Website Lets Users Scout the Red Planet from Home (SPACE.com),"SPACE.com - For those who want to explore Mars but cant wait for a spacecraft to take them there, NASA scientists have reformulated a website that lets the general public search data and images from previous missions."
123,4,Appeal Rejected in Trout Restoration Plan (AP),"AP - The U.S. Forest Service on Wednesday rejected environmentalists' appeal of a plan to poison a stream south of Lake Tahoe to aid what wildlife officials call ""the rarest trout in America."""
124,4,Explore the Many Colors of Stars (SPACE.com),SPACE.com - One of the pleasures of \  stargazing is noticing and enjoying the various colors that stars display in \  dark skies. These hues offer direct visual evidence of how stellar temperatures \  vary.
125,4,Britain Grants Human Cloning License (AP),"AP - Britain granted its first license for human cloning Wednesday, joining South Korea on the leading edge of stem cell research, which is restricted by the Bush administration and which many scientists believe may lead to new treatments for a range of diseases."
126,4,The Next Great Space Race: SpaceShipOne and Wild Fire to Go For the Gold (SPACE.com),SPACE.com - A piloted rocket ship race to claim a  #36;10 million Ansari X Prize purse for privately financed flight to the edge of space is heating up.
127,4,"Growth, Mortality of T. Rex Gets Clearer (AP)","AP - Here's a dinosaur finding that parents can appreciate: The teenage Tyrannosaurus rex typically went through an explosive growth spurt, gaining nearly 5 pounds a day."
128,4,Space Science Pioneer Van Allen Questions Human Spaceflight (SPACE.com),"SPACE.com - A leading space scientist has called to question the validity of human spaceflight, suggesting that sending astronauts outward from Earth is outdated, too costly, and the science returned is trivial."
129,4,China Begins Manned Space Flight Countdown (AP),"AP - Chinese astronauts are in the final stages of preparing for a manned space mission that will orbit the globe 14 times before returning to Earth, a state-run newspaper reported Thursday."
130,4,Sunspot Grows to 20 Times Size of Earth (SPACE.com),SPACE.com - A sunspot group aimed squarely \  at Earth has grown to 20 times the size of our planet and has the potential \  to unleash a major solar storm.
131,4,Japanese Lunar Probe Facing Delays (AP),"AP - A lunar orbiter that Japan had planned to launch this year could face further delays, possibly until next year or later, because of a funding shortfall and problems developing the probe's information-gathering capabilities, Japan's space agency said Wednesday."
132,4,Pollutants From Asia Appear on East Coast (AP),AP - Scientists looking into air quality and climate change have found pollutants from as far as Asia over New England and the Atlantic.
133,4,Vietnam's Citadel Vulnerable to Weather (AP),"AP - Experts from Europe and Asia surveyed 1,400-year-old relics of an ancient citadel in Hanoi Tuesday and said they were concerned the priceless antiquities were at risk from exposure to the elements."
134,4,U.S. Barred From Weakening Dolphin Rules (AP),"AP - In a victory for environmentalists, a federal judge ruled Tuesday that the Bush administration cannot change the standards commercial fisheries must meet before the tuna they catch can carry the ""dolphin-safe"" label."
135,4,Canadian Robot a Candidate to Save Hubble (AP),AP - NASA said Tuesday it is moving ahead with plans to send a robot to the rescue of the aging Hubble Space Telescope.
136,4,Cave Explorers Discover Pit in Croatia (AP),"AP - Cave explorers discovered a pit inside a mountain range in central Croatia believed to have the world's deepest subterranean vertical drop, at nearly 1,700 feet, a scientific institute reported Monday."
137,4,Aquarium Reviews Death of Dolphin (AP),AP - The chief scientist at the National Aquarium in Baltimore has launched a review of the dolphin breeding program after the death of a 4-month-old dolphin.
138,4,Scientists Seek Better Way to Measure Rain (AP),AP - Meteorologists at North Carolina State University are working on a way to more accurately measure rainfall in small areas.
139,4,Wash. State Team's Private Rocket Explodes (AP),"AP - A team taking a low-budget stab at the  #36;10 million Ansari X Prize for private manned spaceflight suffered a setback Sunday, when their rocket malfunctioned and exploded after shooting less than 1,000 feet in the air."
140,4,Nevada Ponders Superfund Status for Mine (AP),"AP - Pressured by a ranking senator from Nevada and the Environmental Protection Agency, Gov. Kenny Guinn says he might reconsider his opposition to a federal Superfund cleanup declaration for a huge abandoned mine contaminated with toxic waste and uranium."
141,4,Indictments Using DNA on Rise Nationally (AP),"AP - Authorities once had no choice but to drop rape cases if they weren't able to catch a suspect before the statute of limitations expired. But prosecutors across the country increasingly are buying themselves time, keeping cold cases alive by indicting unidentified rapists using their DNA profiles."
142,4,Southeast Coast Sees Fewer Turtle Nests (AP),"AP - About half the usual number of loggerhead turtles have nested between North Carolina and Florida this season, and scientists have no explanation for the drop."
143,4,Company Said to Be Ready to Clone Pets (AP),"AP - A company that unveiled the world's first cloned cat nearly three years ago now says it is ready to start filling orders for cloned pets, a newspaper reported Thursday."
144,4,Deep-Sea Vessel Puts Ocean Floor in Reach (AP),"AP - A new deep-sea research vessel will be able to carry people to 99 percent of the ocean floor, diving deeper than the famed Alvin that pioneered the study of seafloor vents, plate tectonics and deep ocean creatures over the past 40 years."
145,4,Chorus Frog Found Croaking in Virginia (AP),"AP - The Southern chorus frog has been found in southeastern Virginia, far outside its previously known range. The animal had never before been reported north of Beaufort County, N.C., about 125 miles to the south."
146,4,Expedition to Probe Gulf of Mexico (AP),"AP - Scientists will use advanced technology never before deployed beneath the sea as they try to discover new creatures, behaviors and phenomena in a 10-day expedition to the Gulf of Mexico's deepest reaches."
147,4,Feds Accused of Exaggerating Fire Impact (AP),"AP - The Forest Service exaggerated the effect of wildfires on California spotted owls in justifying a planned increase in logging in the Sierra Nevada, according to a longtime agency expert who worked on the plan."
148,4,New Method May Predict Quakes Weeks Ahead (AP),"AP - Swedish geologists may have found a way to predict earthquakes weeks before they happen by monitoring the amount of metals like zinc and copper in subsoil water near earthquake sites, scientists said Wednesday."
149,4,Marine Expedition Finds New Species (AP),AP - Norwegian scientists who explored the deep waters of the Atlantic Ocean said Thursday their findings  #151; including what appear to be new species of fish and squid  #151; could be used to protect marine ecosystems worldwide.
150,4,Annual Study Finds Rise in Beach Closures (AP),"AP - The number of days that beaches closed or posted warnings because of pollution rose sharply in 2003 due to more rainfall, increased monitoring and tougher standards, an environmental group said on Thursday."
151,4,Pacific May Be Seeing New El Nino (AP),AP - Warming water temperatures in the central equatorial Pacific last month may indicate the start of a new El Nino.
152,4,Cassini Spacecraft Sees Saturn Lightning (AP),"AP - The Cassini spacecraft's mission to Saturn has revealed a new radiation belt around the ringed planet and found that lightning in its atmosphere is occurring in different patterns than it did when NASA's Voyagers flew by in the early 1980s, scientists said."
153,4,Poachers Putting Endangered Rhinos at Risk (AP),"AP - Gangs of poachers in Congo have been slaughtering the world's minuscule population of northern white rhinos, reducing the population by about one-half in just more than a year, a key conservation organization said Friday."
154,4,Experts Downplay Texas Shark Attacks (AP),"AP - Three shark attacks off the Texas coast in the past two months are unusual but don't mean there are more sharks than normal along the beach or that they are getting bolder, marine biologists and other experts say."
155,4,Study Says Birds Feed Other Birds' Young (AP),"AP - It's a lesson many little humans could learn from baby birds: Sometimes, being nice to other youngsters pays off. Brown-headed cowbirds, like several other bird species, leave their eggs in the nests of other birds, who then feed and raise the cowbird chicks."
156,4,Canadian Team Joins Rocket Launch Contest (AP),"AP - The  #36;10 million competition to send a private manned rocket into space started looking more like a race Thursday, when a Canadian team announced plans to launch its rocket three days after an American group intends to begin qualifying for the Ansari X prize."
157,4,Universities to Build Largest Telescope (AP),AP - The University of Texas and Texas A amp;M University are planning to construct what they call the world's largest telescope with the help of a Houston businessman's  #36;1.25 million gift.
158,4,Mauritanian Capital Battles Locust Swarm (AP),AP - Residents burned tires and trash in the streets Thursday trying to drive off swarms of locusts descending on the region in what a U.N. agency called the worst sub-Saharan invasion in more than a decade.
159,4,Customers of Telco Companies Face Privacy Breach,"A security advisory posted on Bugtraq demonstrates how hackers can compromise customers of T-mobile wireless and Verizon (landline) voicemail boxes. The advisory talks about the use of Caller-ID spoofing the customers number, allowing a bypass of the PIN code since the voicemail thinks that the customer is calling to check their own voicemail. According to Secure Science Corporation, there has been no response from the vendors. Comments have been posted that T-Mobile has optional PIN code protection off by default. Better turn it on. "
160,4,"Mozilla To Add Support For XForms, World Yawns","It's ironic that Microsoft could help further cement its dominance in the browser market by joining its largest rival in an effort to support web standards.  nbsp;At the same time, that act would go a long way towards improving the web in general for developers and users alike."
161,4,Junk faxes to be legalized as  quot;opt-out? quot;,"The Register ran a story on August 6th called 'Phone spam misery looms stateside.' It seems that there's legislative nastiness underway in Washington, DC to essentially gut the existing junk fax law, and replace it with a marketer's wet dream."
162,4,Biased Against Whom?,Liberal bias versus right-wing conspiracy is a wonderful distraction. There is evidence enough on both sides. How can opposite claims be true? Confront a physicist with evidence supporting contradictory hypotheses and she will go looking for a more basic cause. Let's try that.
163,4,The Visual World of Michel Gondry,"A month ago I was introduced to the works of Michel Gondry.  In short, I was amazed and tantalized by his short films and music videos.  Even if you haven't heard of him, you've probably seen his many works in Gap commercials, various music videos, and the recent movie Eternal Sunshine of the Spotless Mind.    Many of his works explode with visual elements that, when taken alone, are simple and mundane.  However, under his masterful guidance, these elements come together to form a highly mesmerizing visual experience.  He never ceases to push visual technologies and challenge our ideas about the visual medium."
164,4,The Austral-Asian Strike Fighter,"The Australian Defence Force must defend and project across an air-sea gap. This requires long range autonomous strike weaponry. The Joint Strike Fighter does not solve this issue and detrimentally places added pressure on Australia's limited force of aerial refuelling assets. The world's defence manufacturers are not creating strike platforms that solve Australian needs. For this reason, Australia needs to look to other nations with similar defence needs. In this case, Japan, South Korea and Taiwan all face defending an air-sea gap. Australia should enter a partnership with these nations to create a strike fighter that satisfies the strategic needs of defending an air-sea gap. The benefits of such a partnership will be many."
165,4,Insecurity: (Or Why Americans Aren't Feeling The Recovery),"The New Republic's website is currently carrying an interesting piece which tries to explain the anomaly that although the US economy is growing, a lot of its citizens are still feeling worse off. The article explains the results of a 40 year panel study which has shown that although mean incomes have increased, income variability has increased massively, causing many Americans to feel less well off, despite the growing economy.      "
166,4,The Great K5 Limerick Contest,"Queue submissions being scarce, I suggest we all submit limericks for consideration.  Mod up your favorites.    I'm no poet, so I'll submit a favorite of my childhood:    There was a young woman named Bright,  Who traveled much faster than light    She set out one day  In a relative way    And returned on the previous night.    I'm afraid I don't remember the author."
167,4,RuntimeProperties... Reflection from System Properties,"\\Java developers often load system properties to customize the runtime behavior\of their applications.\\For example a develoepr could define a 'max_connections' system property to\define the maximum number of TCP connections that their application server can\support.  While nice, this prevents all other applications from using this\variable name.\\The first reaction to this would be to namespace your variable names.  Instead\of using max_connections you would now use\'my.application.Server.MAX_CONNECTIONS' as your property name.  This works of\course but now you have to load this property on startup.\\public static int MAX_CONNECTIONS = Integer.parseInt( System.getProperty(\""my.application.Se ...\\"
168,4,Thank You IBM!,\\I just wanted to say thanks to IBM for Open Sourcing  Cloudscape .\\You guys really have your act together.  Keep up the good work!\\
169,4,"LinuxWorld, IDs, and Privacy",\\Today Jonathan Moore  and I headed over to LinuxWorld after lunch to see what\kind of cool hardware and Linux hacks they had on the expo floor.\\Only \$15 to get in the door so I figure why not.\\I'm a bit of a privacy freak.  When you're trading some security for liberty\there are situations where it *might* be worth it.  In situations of extreme\violence having the police by your side might be a good idea.  \\I think we can all agree that trading liberty for *nothing* isn't worth it.\This country was *founded* on liberty after the British were abusing their\colonial powers.  Every true American should cherish their liberty and think\long and hard about just turning them over for no reason.\ ...\\
170,4,My Blog as a Time Machine,\\I'm starting to realize that my blog is a bit of a time machine.  For example I\can create a blog entry to warn myself about something that WILL happen in the\future.  \\My current NTP  blog entry is a good example.  I wrote this for myself as\much as for the people who read my blog (or find me via Google).\\I know for sure that NTP on Debian is going to bite me sometime in the future\and I'm going to forget WHY.  Then I'm going to (of course) go to Google or my\aggregator and search for NTP and then find my blog post.  \\I've done this about a dozen times now and its saved me a TON of time!\\
171,4,NTP in Debian,\\The Network Time Daemon (NTP  Daemon) implementation within Debian leaves a\lot to be desired.\\First off they don't include it with a working config.  You have to create your\own /etc/ntpd.conf.  To make matters worse the configuration doesn't accept DNS\names so you have to manually enter IPs.  Fun.  I can understand that they might\not want to provide ONE configuration and overwhelm one or two NTP servers but\they can provide a dynamic config that balances load among all available\servers.  There is of course the public serves list  but you have to Google\for it.\\All you really need to do here is enter a list of servers:\\server time.nist.gov\\server 192.43.244.18\
172,4,Pretty Log4J,"\\I've been a big fan of Log4J  for a while now but haven't migrated any code\over for one central reason.  The following line of code:\\    final static Logger logger = Logger.getLogger( ""some.name"" );\\... is amazingly ugly and difficult to work with.\\Most people use Log4J with a logger based on the classname:\\So we would probably see:\\    static Logger logger = Logger.getLogger( ""org.apache.commons.feedparser.locate.FeedLocator"" );\\Which is amazingly verbose.  A lot of developers shorten this to:\\    static Logger logger = Logger.getLogger( FeedLocator.class );\\But this still leaves us with cut and paste errors.\\What if we could just reduce it to:\\    static Logger logger = Logger.g ...\\"
173,4,Saudis: Bin Laden associate surrenders,"\\""(CNN) -- A longtime associate of al Qaeda leader Osama bin Laden surrendered to\Saudi Arabian officials Tuesday, a Saudi Interior Ministry official said.""\\""But it is unclear what role, if any, Khaled al-Harbi may have had in any terror\attacks because no public charges have been filed against him.""\\""The Saudi government -- in a statement released by its embassy in Washington --\called al-Harbi's surrender ""the latest direct result"" of its limited, one-month\offer of leniency to terror suspects.""\\This is great!  I hope this really starts to pay off.  Creative solutions to\terrorism that don't involve violence.  \\How refreshing! \\Are you paying attention Bush administration?\\"
174,4,Mozilla Exceptions (mexception),\\For some reason I never released this code.\\I developed it while working on NewsMonster and just forgot I think\\It's an extension for Mozilla that allows you to see all runtime exceptions\(with full stack traces) that are unhandled by Mozilla. \\Just install it and if your code generates an unhandled exception it will show\up in the logs and on the console.\\Very handy for doing any hardcore Mozilla development.\\
175,4,Ron Regan Jr is My Kinda Guy,"\\""Now that the country is awash in Reagan nostalgia, some observers are predicting\that you will enter politics. Would you like to be president of the United\States?""\\""I would be unelectable. I'm an atheist. As we all know, that is something\people won't accept.""\\""What would you do if Senator Kerry asked you to be his vice president?""\\""I would question his sanity.""\\""Do you ever go to church?""\\""No. I visit my wife's sangha.""\\""So you sometimes practice Buddhism?""\\""I don't claim anything. But my sympathies would be in that direction. I admire\the fact that the central core of Buddhist teaching involves mindfulness and\loving kindness and compassion.""\\So lets get this straight.  He's an a ...\\"
176,4,Al Qaeda member surrenders,"\\""RIYADH, Saudi Arabia (CNN) -- One of Saudi Arabia's most wanted militants has\turned himself into the authorities, the first senior suspect to surrender under\a one-month government amnesty announced last week.""\\""Othman Al-Omari, number 19 on Saudi Arabia's most wanted list of 26, accepted\King Fahd's offer of amnesty, which was made last week, according to Saudi\sources Monday.""\\""Al-Omari, who turned himself in on Sunday night, was a business partner of\Shaban Al Shihri -- the first al Qaeda member to accept the offer when he turned\himself in Friday.""\\When I first saw this I was really upset.  I thought that it would certainly\lead to more violence if they just let terrorists off the ...\\"
177,4,Mission Accomplished!,"\\""BAGHDAD, Iraq (CNN) -- Members of Iraq's interim government took an oath of\office Monday just hours after the United States returned the nation's\sovereignty, two days ahead of schedule.""\\""Led by Iraq's interim Prime Minister Ayad Allawi, each member of the new\government placed a hand on the Koran and promised to serve with sincerity and\impartiality. Iraqi flags lined the wall behind them.""\\Iraq!  Now with 100 less Coalition Provisional Authority!  Act now and get a\free Weapon of Mass Destruction (offer only available in Syria, Jordan, Saudi\Arabia, Pakistan, Syria and Iran).\\Also check out our new Puppet Government!  Keeps the kids occupied for hours!\\"
178,4,Java3D - Half Right,"\\SUN has announced that Java3D will be released in a different manner than any\other SUN project in existence.\\""We announce the availability of the source code for the Java 3D API on\java.net.  We are involving developers in the evolution of the Java 3D API.\Come join the Java 3D projects on java.net, and download the source code for\the core Java 3D API, vecmath, the Java 3D core utilities, and the Java 3D\program examples.""\\The key thing here is that they have provided the core utils under a BSD license\and even have the CVS available .\\Good job SUN!  You're headed in the right direction!\\Here's the only problem:\\""We are releasing the source code for the j3d-core and vecmath projects u ...\\"
179,4,Reverse Psychology,"\\I really hope SUN doesn't Open Source Java at JavaOne this year.  It would be a\terrible decision and seriously hurt the tech industry.  Also, it would hurt SUN\and I'm sure their responsible enough to realize this.\\(Lets hope that works!)\\"
